========================================================================
Job started at: Wed Dec  3 10:56:42 EST 2025
Job ID: 127603
Node: gpunode5
========================================================================

Setting up environment...
----------------------------------------
Activating conda environment...

Environment check:
----------------------------------------
Python 3.8.8
PyTorch version: 2.4.1+cu121
CUDA available: True
GPU name: NVIDIA H100 80GB HBM3
GPU memory: 81559 MiB

Checking required files...
----------------------------------------
-rw-rw-r--. 1 dipanjan dipanjan 72K Dec  2 13:41 daic_metadata.csv
-rw-rw-r--. 1 dipanjan dipanjan 190K Dec  2 13:44 acoustic_features.csv
-rw-rw-r--. 1 dipanjan dipanjan 102K Dec  2 13:45 visual_features.csv
-rw-rw-r--. 1 dipanjan dipanjan 9.1K Dec  3 07:56 genai_extraction.py
-rw-rw-r--. 1 dipanjan dipanjan 9.9K Dec  3 07:20 genai_extraction_llama3.py
-rw-rw-r--. 1 dipanjan dipanjan 6.7K Dec  3 09:00 genai_multimodal.py

========================================================================
Starting GenAI feature extraction...
========================================================================

/home/dipanjan/.local/lib/python3.8/site-packages/transformers/utils/hub.py:128: FutureWarning: Using `TRANSFORMERS_CACHE` is deprecated and will be removed in v5 of Transformers. Use `HF_HOME` instead.
  warnings.warn(
2025-12-03 10:57:55,502 - INFO - Using device: cuda
2025-12-03 10:57:55,506 - INFO - Found Llama-3 model at: /home/dipanjan/.cache/huggingface/hub/models--meta-llama--Meta-Llama-3-8B-Instruct/snapshots/8afb486c1db24fe5011ec46dfbe5b5dccdb575c2
2025-12-03 10:57:55,506 - INFO - Loading model from: /home/dipanjan/.cache/huggingface/hub/models--meta-llama--Meta-Llama-3-8B-Instruct/snapshots/8afb486c1db24fe5011ec46dfbe5b5dccdb575c2
2025-12-03 10:58:00,443 - INFO - We will use 90% of the memory on device 0 for storing the model, and 10% for the buffer to avoid OOM. You can set `max_memory` in to a higher value to use more memory (at your own risk).
Loading checkpoint shards:   0%|          | 0/4 [00:00<?, ?it/s]Loading checkpoint shards:  25%|██▌       | 1/4 [05:41<17:03, 341.28s/it]Loading checkpoint shards:  50%|█████     | 2/4 [11:48<11:52, 356.42s/it]Loading checkpoint shards:  75%|███████▌  | 3/4 [16:47<05:30, 330.22s/it]Loading checkpoint shards: 100%|██████████| 4/4 [17:49<00:00, 224.33s/it]Loading checkpoint shards: 100%|██████████| 4/4 [17:49<00:00, 267.34s/it]
2025-12-03 11:15:50,262 - INFO - Loaded 189 participants
2025-12-03 11:15:50,262 - INFO - ================================================================================
2025-12-03 11:15:50,262 - INFO - Starting Hierarchical Multimodal Feature Extraction Pipeline
2025-12-03 11:15:50,262 - INFO - ================================================================================
2025-12-03 11:15:50,387 - INFO - Total participants: 189
2025-12-03 11:15:50,387 - INFO - Already processed: 0
2025-12-03 11:15:50,387 - INFO - Remaining: 189
2025-12-03 11:15:50,387 - INFO - 
[1/189] Processing 303...
2025-12-03 11:15:50,387 - INFO - Processing participant: 303
2025-12-03 11:15:50,403 - ERROR -   ✗ Error processing participant 303: 'value'
2025-12-03 11:15:50,403 - INFO - 
[2/189] Processing 304...
2025-12-03 11:15:50,404 - INFO - Processing participant: 304
2025-12-03 11:15:50,424 - ERROR -   ✗ Error processing participant 304: 'value'
2025-12-03 11:15:50,424 - INFO - 
[3/189] Processing 305...
2025-12-03 11:15:50,425 - INFO - Processing participant: 305
2025-12-03 11:15:50,444 - ERROR -   ✗ Error processing participant 305: 'value'
2025-12-03 11:15:50,444 - INFO - 
[4/189] Processing 310...
2025-12-03 11:15:50,444 - INFO - Processing participant: 310
2025-12-03 11:15:50,465 - ERROR -   ✗ Error processing participant 310: 'value'
2025-12-03 11:15:50,465 - INFO - 
[5/189] Processing 312...
2025-12-03 11:15:50,465 - INFO - Processing participant: 312
2025-12-03 11:15:50,480 - ERROR -   ✗ Error processing participant 312: 'value'
2025-12-03 11:15:50,480 - INFO - 
[6/189] Processing 313...
2025-12-03 11:15:50,481 - INFO - Processing participant: 313
2025-12-03 11:15:50,492 - ERROR -   ✗ Error processing participant 313: 'value'
2025-12-03 11:15:50,493 - INFO - 
[7/189] Processing 315...
2025-12-03 11:15:50,493 - INFO - Processing participant: 315
2025-12-03 11:15:50,505 - ERROR -   ✗ Error processing participant 315: 'value'
2025-12-03 11:15:50,505 - INFO - 
[8/189] Processing 316...
2025-12-03 11:15:50,505 - INFO - Processing participant: 316
2025-12-03 11:15:50,530 - ERROR -   ✗ Error processing participant 316: 'value'
2025-12-03 11:15:50,530 - INFO - 
[9/189] Processing 317...
2025-12-03 11:15:50,530 - INFO - Processing participant: 317
2025-12-03 11:15:50,541 - ERROR -   ✗ Error processing participant 317: 'value'
2025-12-03 11:15:50,541 - INFO - 
[10/189] Processing 318...
2025-12-03 11:15:50,541 - INFO - Processing participant: 318
2025-12-03 11:15:50,579 - ERROR -   ✗ Error processing participant 318: 'value'
2025-12-03 11:15:50,580 - INFO - 
[11/189] Processing 319...
2025-12-03 11:15:50,580 - INFO - Processing participant: 319
2025-12-03 11:15:50,610 - ERROR -   ✗ Error processing participant 319: 'value'
2025-12-03 11:15:50,610 - INFO - 
[12/189] Processing 320...
2025-12-03 11:15:50,610 - INFO - Processing participant: 320
2025-12-03 11:15:50,632 - ERROR -   ✗ Error processing participant 320: 'value'
2025-12-03 11:15:50,632 - INFO - 
[13/189] Processing 321...
2025-12-03 11:15:50,632 - INFO - Processing participant: 321
2025-12-03 11:15:50,650 - ERROR -   ✗ Error processing participant 321: 'value'
2025-12-03 11:15:50,650 - INFO - 
[14/189] Processing 322...
2025-12-03 11:15:50,650 - INFO - Processing participant: 322
2025-12-03 11:15:50,679 - ERROR -   ✗ Error processing participant 322: 'value'
2025-12-03 11:15:50,679 - INFO - 
[15/189] Processing 324...
2025-12-03 11:15:50,679 - INFO - Processing participant: 324
2025-12-03 11:15:50,697 - ERROR -   ✗ Error processing participant 324: 'value'
2025-12-03 11:15:50,697 - INFO - 
[16/189] Processing 325...
2025-12-03 11:15:50,697 - INFO - Processing participant: 325
2025-12-03 11:15:50,724 - ERROR -   ✗ Error processing participant 325: 'value'
2025-12-03 11:15:50,724 - INFO - 
[17/189] Processing 326...
2025-12-03 11:15:50,725 - INFO - Processing participant: 326
2025-12-03 11:15:50,746 - ERROR -   ✗ Error processing participant 326: 'value'
2025-12-03 11:15:50,746 - INFO - 
[18/189] Processing 327...
2025-12-03 11:15:50,746 - INFO - Processing participant: 327
2025-12-03 11:15:50,776 - ERROR -   ✗ Error processing participant 327: 'value'
2025-12-03 11:15:50,776 - INFO - 
[19/189] Processing 328...
2025-12-03 11:15:50,777 - INFO - Processing participant: 328
2025-12-03 11:15:50,796 - ERROR -   ✗ Error processing participant 328: 'value'
2025-12-03 11:15:50,797 - INFO - 
[20/189] Processing 330...
2025-12-03 11:15:50,797 - INFO - Processing participant: 330
2025-12-03 11:15:50,818 - ERROR -   ✗ Error processing participant 330: 'value'
2025-12-03 11:15:50,818 - INFO - 
[21/189] Processing 333...
2025-12-03 11:15:50,818 - INFO - Processing participant: 333
2025-12-03 11:15:50,843 - ERROR -   ✗ Error processing participant 333: 'value'
2025-12-03 11:15:50,843 - INFO - 
[22/189] Processing 336...
2025-12-03 11:15:50,843 - INFO - Processing participant: 336
2025-12-03 11:15:50,869 - ERROR -   ✗ Error processing participant 336: 'value'
2025-12-03 11:15:50,869 - INFO - 
[23/189] Processing 338...
2025-12-03 11:15:50,869 - INFO - Processing participant: 338
2025-12-03 11:15:50,888 - ERROR -   ✗ Error processing participant 338: 'value'
2025-12-03 11:15:50,888 - INFO - 
[24/189] Processing 339...
2025-12-03 11:15:50,888 - INFO - Processing participant: 339
2025-12-03 11:15:50,909 - ERROR -   ✗ Error processing participant 339: 'value'
2025-12-03 11:15:50,909 - INFO - 
[25/189] Processing 340...
2025-12-03 11:15:50,909 - INFO - Processing participant: 340
2025-12-03 11:15:50,923 - ERROR -   ✗ Error processing participant 340: 'value'
2025-12-03 11:15:50,923 - INFO - 
[26/189] Processing 341...
2025-12-03 11:15:50,923 - INFO - Processing participant: 341
2025-12-03 11:15:50,942 - ERROR -   ✗ Error processing participant 341: 'value'
2025-12-03 11:15:50,943 - INFO - 
[27/189] Processing 343...
2025-12-03 11:15:50,943 - INFO - Processing participant: 343
2025-12-03 11:15:50,960 - ERROR -   ✗ Error processing participant 343: 'value'
2025-12-03 11:15:50,960 - INFO - 
[28/189] Processing 344...
2025-12-03 11:15:50,960 - INFO - Processing participant: 344
2025-12-03 11:15:50,978 - ERROR -   ✗ Error processing participant 344: 'value'
2025-12-03 11:15:50,978 - INFO - 
[29/189] Processing 345...
2025-12-03 11:15:50,978 - INFO - Processing participant: 345
2025-12-03 11:15:50,993 - ERROR -   ✗ Error processing participant 345: 'value'
2025-12-03 11:15:50,993 - INFO - 
[30/189] Processing 347...
2025-12-03 11:15:50,993 - INFO - Processing participant: 347
2025-12-03 11:15:51,007 - ERROR -   ✗ Error processing participant 347: 'value'
2025-12-03 11:15:51,007 - INFO - 
[31/189] Processing 348...
2025-12-03 11:15:51,007 - INFO - Processing participant: 348
2025-12-03 11:15:51,026 - ERROR -   ✗ Error processing participant 348: 'value'
2025-12-03 11:15:51,026 - INFO - 
[32/189] Processing 350...
2025-12-03 11:15:51,026 - INFO - Processing participant: 350
2025-12-03 11:15:51,044 - ERROR -   ✗ Error processing participant 350: 'value'
2025-12-03 11:15:51,044 - INFO - 
[33/189] Processing 351...
2025-12-03 11:15:51,044 - INFO - Processing participant: 351
2025-12-03 11:15:51,055 - ERROR -   ✗ Error processing participant 351: 'value'
2025-12-03 11:15:51,056 - INFO - 
[34/189] Processing 352...
2025-12-03 11:15:51,056 - INFO - Processing participant: 352
2025-12-03 11:15:51,074 - ERROR -   ✗ Error processing participant 352: 'value'
2025-12-03 11:15:51,074 - INFO - 
[35/189] Processing 353...
2025-12-03 11:15:51,074 - INFO - Processing participant: 353
2025-12-03 11:15:51,087 - ERROR -   ✗ Error processing participant 353: 'value'
2025-12-03 11:15:51,087 - INFO - 
[36/189] Processing 355...
2025-12-03 11:15:51,087 - INFO - Processing participant: 355
2025-12-03 11:15:51,103 - ERROR -   ✗ Error processing participant 355: 'value'
2025-12-03 11:15:51,103 - INFO - 
[37/189] Processing 356...
2025-12-03 11:15:51,103 - INFO - Processing participant: 356
2025-12-03 11:15:51,130 - ERROR -   ✗ Error processing participant 356: 'value'
2025-12-03 11:15:51,131 - INFO - 
[38/189] Processing 357...
2025-12-03 11:15:51,131 - INFO - Processing participant: 357
2025-12-03 11:15:51,144 - ERROR -   ✗ Error processing participant 357: 'value'
2025-12-03 11:15:51,144 - INFO - 
[39/189] Processing 358...
2025-12-03 11:15:51,144 - INFO - Processing participant: 358
2025-12-03 11:15:51,156 - ERROR -   ✗ Error processing participant 358: 'value'
2025-12-03 11:15:51,156 - INFO - 
[40/189] Processing 360...
2025-12-03 11:15:51,156 - INFO - Processing participant: 360
2025-12-03 11:15:51,174 - ERROR -   ✗ Error processing participant 360: 'value'
2025-12-03 11:15:51,174 - INFO - 
[41/189] Processing 362...
2025-12-03 11:15:51,174 - INFO - Processing participant: 362
2025-12-03 11:15:51,191 - ERROR -   ✗ Error processing participant 362: 'value'
2025-12-03 11:15:51,192 - INFO - 
[42/189] Processing 363...
2025-12-03 11:15:51,192 - INFO - Processing participant: 363
2025-12-03 11:15:51,216 - ERROR -   ✗ Error processing participant 363: 'value'
2025-12-03 11:15:51,217 - INFO - 
[43/189] Processing 364...
2025-12-03 11:15:51,217 - INFO - Processing participant: 364
2025-12-03 11:15:51,233 - ERROR -   ✗ Error processing participant 364: 'value'
2025-12-03 11:15:51,234 - INFO - 
[44/189] Processing 366...
2025-12-03 11:15:51,234 - INFO - Processing participant: 366
2025-12-03 11:15:51,284 - ERROR -   ✗ Error processing participant 366: 'value'
2025-12-03 11:15:51,284 - INFO - 
[45/189] Processing 368...
2025-12-03 11:15:51,284 - INFO - Processing participant: 368
2025-12-03 11:15:51,314 - ERROR -   ✗ Error processing participant 368: 'value'
2025-12-03 11:15:51,314 - INFO - 
[46/189] Processing 369...
2025-12-03 11:15:51,314 - INFO - Processing participant: 369
2025-12-03 11:15:51,336 - ERROR -   ✗ Error processing participant 369: 'value'
2025-12-03 11:15:51,336 - INFO - 
[47/189] Processing 370...
2025-12-03 11:15:51,336 - INFO - Processing participant: 370
2025-12-03 11:15:51,357 - ERROR -   ✗ Error processing participant 370: 'value'
2025-12-03 11:15:51,358 - INFO - 
[48/189] Processing 371...
2025-12-03 11:15:51,358 - INFO - Processing participant: 371
2025-12-03 11:15:51,374 - ERROR -   ✗ Error processing participant 371: 'value'
2025-12-03 11:15:51,374 - INFO - 
[49/189] Processing 372...
2025-12-03 11:15:51,374 - INFO - Processing participant: 372
2025-12-03 11:15:51,398 - ERROR -   ✗ Error processing participant 372: 'value'
2025-12-03 11:15:51,398 - INFO - 
[50/189] Processing 374...
2025-12-03 11:15:51,398 - INFO - Processing participant: 374
2025-12-03 11:15:51,427 - ERROR -   ✗ Error processing participant 374: 'value'
2025-12-03 11:15:51,427 - INFO - 
[51/189] Processing 375...
2025-12-03 11:15:51,427 - INFO - Processing participant: 375
2025-12-03 11:15:51,449 - ERROR -   ✗ Error processing participant 375: 'value'
2025-12-03 11:15:51,449 - INFO - 
[52/189] Processing 376...
2025-12-03 11:15:51,449 - INFO - Processing participant: 376
2025-12-03 11:15:51,469 - ERROR -   ✗ Error processing participant 376: 'value'
2025-12-03 11:15:51,469 - INFO - 
[53/189] Processing 379...
2025-12-03 11:15:51,469 - INFO - Processing participant: 379
2025-12-03 11:15:51,490 - ERROR -   ✗ Error processing participant 379: 'value'
2025-12-03 11:15:51,490 - INFO - 
[54/189] Processing 380...
2025-12-03 11:15:51,490 - INFO - Processing participant: 380
2025-12-03 11:15:51,510 - ERROR -   ✗ Error processing participant 380: 'value'
2025-12-03 11:15:51,511 - INFO - 
[55/189] Processing 383...
2025-12-03 11:15:51,511 - INFO - Processing participant: 383
2025-12-03 11:15:51,535 - ERROR -   ✗ Error processing participant 383: 'value'
2025-12-03 11:15:51,535 - INFO - 
[56/189] Processing 385...
2025-12-03 11:15:51,535 - INFO - Processing participant: 385
2025-12-03 11:15:51,553 - ERROR -   ✗ Error processing participant 385: 'value'
2025-12-03 11:15:51,553 - INFO - 
[57/189] Processing 386...
2025-12-03 11:15:51,553 - INFO - Processing participant: 386
2025-12-03 11:15:51,597 - ERROR -   ✗ Error processing participant 386: 'value'
2025-12-03 11:15:51,598 - INFO - 
[58/189] Processing 391...
2025-12-03 11:15:51,598 - INFO - Processing participant: 391
2025-12-03 11:15:51,619 - ERROR -   ✗ Error processing participant 391: 'value'
2025-12-03 11:15:51,619 - INFO - 
[59/189] Processing 392...
2025-12-03 11:15:51,619 - INFO - Processing participant: 392
2025-12-03 11:15:51,643 - ERROR -   ✗ Error processing participant 392: 'value'
2025-12-03 11:15:51,643 - INFO - 
[60/189] Processing 393...
2025-12-03 11:15:51,643 - INFO - Processing participant: 393
2025-12-03 11:15:51,659 - ERROR -   ✗ Error processing participant 393: 'value'
2025-12-03 11:15:51,659 - INFO - 
[61/189] Processing 397...
2025-12-03 11:15:51,659 - INFO - Processing participant: 397
2025-12-03 11:15:51,674 - ERROR -   ✗ Error processing participant 397: 'value'
2025-12-03 11:15:51,674 - INFO - 
[62/189] Processing 400...
2025-12-03 11:15:51,674 - INFO - Processing participant: 400
2025-12-03 11:15:51,698 - ERROR -   ✗ Error processing participant 400: 'value'
2025-12-03 11:15:51,699 - INFO - 
[63/189] Processing 401...
2025-12-03 11:15:51,699 - INFO - Processing participant: 401
2025-12-03 11:15:51,719 - ERROR -   ✗ Error processing participant 401: 'value'
2025-12-03 11:15:51,719 - INFO - 
[64/189] Processing 402...
2025-12-03 11:15:51,719 - INFO - Processing participant: 402
2025-12-03 11:15:51,733 - ERROR -   ✗ Error processing participant 402: 'value'
2025-12-03 11:15:51,734 - INFO - 
[65/189] Processing 409...
2025-12-03 11:15:51,734 - INFO - Processing participant: 409
2025-12-03 11:15:51,748 - ERROR -   ✗ Error processing participant 409: 'value'
2025-12-03 11:15:51,748 - INFO - 
[66/189] Processing 412...
2025-12-03 11:15:51,748 - INFO - Processing participant: 412
2025-12-03 11:15:51,803 - ERROR -   ✗ Error processing participant 412: 'value'
2025-12-03 11:15:51,803 - INFO - 
[67/189] Processing 414...
2025-12-03 11:15:51,803 - INFO - Processing participant: 414
2025-12-03 11:15:51,818 - ERROR -   ✗ Error processing participant 414: 'value'
2025-12-03 11:15:51,818 - INFO - 
[68/189] Processing 415...
2025-12-03 11:15:51,818 - INFO - Processing participant: 415
2025-12-03 11:15:51,832 - ERROR -   ✗ Error processing participant 415: 'value'
2025-12-03 11:15:51,832 - INFO - 
[69/189] Processing 416...
2025-12-03 11:15:51,832 - INFO - Processing participant: 416
2025-12-03 11:15:51,853 - ERROR -   ✗ Error processing participant 416: 'value'
2025-12-03 11:15:51,853 - INFO - 
[70/189] Processing 419...
2025-12-03 11:15:51,853 - INFO - Processing participant: 419
2025-12-03 11:15:51,869 - ERROR -   ✗ Error processing participant 419: 'value'
2025-12-03 11:15:51,869 - INFO - 
[71/189] Processing 423...
2025-12-03 11:15:51,869 - INFO - Processing participant: 423
2025-12-03 11:15:51,880 - ERROR -   ✗ Error processing participant 423: 'value'
2025-12-03 11:15:51,880 - INFO - 
[72/189] Processing 425...
2025-12-03 11:15:51,880 - INFO - Processing participant: 425
2025-12-03 11:15:51,907 - ERROR -   ✗ Error processing participant 425: 'value'
2025-12-03 11:15:51,907 - INFO - 
[73/189] Processing 426...
2025-12-03 11:15:51,907 - INFO - Processing participant: 426
2025-12-03 11:15:51,927 - ERROR -   ✗ Error processing participant 426: 'value'
2025-12-03 11:15:51,927 - INFO - 
[74/189] Processing 427...
2025-12-03 11:15:51,927 - INFO - Processing participant: 427
2025-12-03 11:15:51,939 - ERROR -   ✗ Error processing participant 427: 'value'
2025-12-03 11:15:51,939 - INFO - 
[75/189] Processing 428...
2025-12-03 11:15:51,939 - INFO - Processing participant: 428
2025-12-03 11:15:51,954 - ERROR -   ✗ Error processing participant 428: 'value'
2025-12-03 11:15:51,954 - INFO - 
[76/189] Processing 429...
2025-12-03 11:15:51,954 - INFO - Processing participant: 429
2025-12-03 11:15:51,968 - ERROR -   ✗ Error processing participant 429: 'value'
2025-12-03 11:15:51,968 - INFO - 
[77/189] Processing 430...
2025-12-03 11:15:51,968 - INFO - Processing participant: 430
2025-12-03 11:15:51,997 - ERROR -   ✗ Error processing participant 430: 'value'
2025-12-03 11:15:51,997 - INFO - 
[78/189] Processing 433...
2025-12-03 11:15:51,998 - INFO - Processing participant: 433
2025-12-03 11:15:52,014 - ERROR -   ✗ Error processing participant 433: 'value'
2025-12-03 11:15:52,014 - INFO - 
[79/189] Processing 434...
2025-12-03 11:15:52,014 - INFO - Processing participant: 434
2025-12-03 11:15:52,035 - ERROR -   ✗ Error processing participant 434: 'value'
2025-12-03 11:15:52,035 - INFO - 
[80/189] Processing 437...
2025-12-03 11:15:52,035 - INFO - Processing participant: 437
2025-12-03 11:15:52,065 - ERROR -   ✗ Error processing participant 437: 'value'
2025-12-03 11:15:52,065 - INFO - 
[81/189] Processing 441...
2025-12-03 11:15:52,065 - INFO - Processing participant: 441
2025-12-03 11:15:52,081 - ERROR -   ✗ Error processing participant 441: 'value'
2025-12-03 11:15:52,081 - INFO - 
[82/189] Processing 443...
2025-12-03 11:15:52,081 - INFO - Processing participant: 443
2025-12-03 11:15:52,110 - ERROR -   ✗ Error processing participant 443: 'value'
2025-12-03 11:15:52,110 - INFO - 
[83/189] Processing 444...
2025-12-03 11:15:52,110 - INFO - Processing participant: 444
2025-12-03 11:15:52,132 - ERROR -   ✗ Error processing participant 444: 'value'
2025-12-03 11:15:52,132 - INFO - 
[84/189] Processing 445...
2025-12-03 11:15:52,132 - INFO - Processing participant: 445
2025-12-03 11:15:52,166 - ERROR -   ✗ Error processing participant 445: 'value'
2025-12-03 11:15:52,166 - INFO - 
[85/189] Processing 446...
2025-12-03 11:15:52,166 - INFO - Processing participant: 446
2025-12-03 11:15:52,191 - ERROR -   ✗ Error processing participant 446: 'value'
2025-12-03 11:15:52,191 - INFO - 
[86/189] Processing 447...
2025-12-03 11:15:52,191 - INFO - Processing participant: 447
2025-12-03 11:15:52,204 - ERROR -   ✗ Error processing participant 447: 'value'
2025-12-03 11:15:52,204 - INFO - 
[87/189] Processing 448...
2025-12-03 11:15:52,204 - INFO - Processing participant: 448
2025-12-03 11:15:52,221 - ERROR -   ✗ Error processing participant 448: 'value'
2025-12-03 11:15:52,221 - INFO - 
[88/189] Processing 449...
2025-12-03 11:15:52,221 - INFO - Processing participant: 449
2025-12-03 11:15:52,253 - ERROR -   ✗ Error processing participant 449: 'value'
2025-12-03 11:15:52,253 - INFO - 
[89/189] Processing 454...
2025-12-03 11:15:52,254 - INFO - Processing participant: 454
2025-12-03 11:15:52,269 - ERROR -   ✗ Error processing participant 454: 'value'
2025-12-03 11:15:52,269 - INFO - 
[90/189] Processing 455...
2025-12-03 11:15:52,269 - INFO - Processing participant: 455
2025-12-03 11:15:52,291 - ERROR -   ✗ Error processing participant 455: 'value'
2025-12-03 11:15:52,291 - INFO - 
[91/189] Processing 456...
2025-12-03 11:15:52,291 - INFO - Processing participant: 456
2025-12-03 11:15:52,312 - ERROR -   ✗ Error processing participant 456: 'value'
2025-12-03 11:15:52,312 - INFO - 
[92/189] Processing 457...
2025-12-03 11:15:52,312 - INFO - Processing participant: 457
2025-12-03 11:15:52,332 - ERROR -   ✗ Error processing participant 457: 'value'
2025-12-03 11:15:52,333 - INFO - 
[93/189] Processing 459...
2025-12-03 11:15:52,333 - INFO - Processing participant: 459
2025-12-03 11:15:52,357 - ERROR -   ✗ Error processing participant 459: 'value'
2025-12-03 11:15:52,357 - INFO - 
[94/189] Processing 463...
2025-12-03 11:15:52,357 - INFO - Processing participant: 463
2025-12-03 11:15:52,395 - ERROR -   ✗ Error processing participant 463: 'value'
2025-12-03 11:15:52,395 - INFO - 
[95/189] Processing 464...
2025-12-03 11:15:52,395 - INFO - Processing participant: 464
2025-12-03 11:15:52,408 - ERROR -   ✗ Error processing participant 464: 'value'
2025-12-03 11:15:52,408 - INFO - 
[96/189] Processing 468...
2025-12-03 11:15:52,408 - INFO - Processing participant: 468
2025-12-03 11:15:52,426 - ERROR -   ✗ Error processing participant 468: 'value'
2025-12-03 11:15:52,426 - INFO - 
[97/189] Processing 471...
2025-12-03 11:15:52,426 - INFO - Processing participant: 471
2025-12-03 11:15:52,447 - ERROR -   ✗ Error processing participant 471: 'value'
2025-12-03 11:15:52,447 - INFO - 
[98/189] Processing 473...
2025-12-03 11:15:52,447 - INFO - Processing participant: 473
2025-12-03 11:15:52,465 - ERROR -   ✗ Error processing participant 473: 'value'
2025-12-03 11:15:52,465 - INFO - 
[99/189] Processing 474...
2025-12-03 11:15:52,465 - INFO - Processing participant: 474
2025-12-03 11:15:52,485 - ERROR -   ✗ Error processing participant 474: 'value'
2025-12-03 11:15:52,485 - INFO - 
[100/189] Processing 475...
2025-12-03 11:15:52,485 - INFO - Processing participant: 475
2025-12-03 11:15:52,517 - ERROR -   ✗ Error processing participant 475: 'value'
2025-12-03 11:15:52,517 - INFO - 
[101/189] Processing 478...
2025-12-03 11:15:52,517 - INFO - Processing participant: 478
2025-12-03 11:15:52,535 - ERROR -   ✗ Error processing participant 478: 'value'
2025-12-03 11:15:52,535 - INFO - 
[102/189] Processing 479...
2025-12-03 11:15:52,535 - INFO - Processing participant: 479
2025-12-03 11:15:52,553 - ERROR -   ✗ Error processing participant 479: 'value'
2025-12-03 11:15:52,553 - INFO - 
[103/189] Processing 485...
2025-12-03 11:15:52,553 - INFO - Processing participant: 485
2025-12-03 11:15:52,556 - ERROR -   ✗ Error processing participant 485: 'value'
2025-12-03 11:15:52,556 - INFO - 
[104/189] Processing 486...
2025-12-03 11:15:52,556 - INFO - Processing participant: 486
2025-12-03 11:15:52,564 - ERROR -   ✗ Error processing participant 486: 'value'
2025-12-03 11:15:52,564 - INFO - 
[105/189] Processing 487...
2025-12-03 11:15:52,564 - INFO - Processing participant: 487
2025-12-03 11:15:52,577 - ERROR -   ✗ Error processing participant 487: 'value'
2025-12-03 11:15:52,577 - INFO - 
[106/189] Processing 488...
2025-12-03 11:15:52,577 - INFO - Processing participant: 488
2025-12-03 11:15:52,600 - ERROR -   ✗ Error processing participant 488: 'value'
2025-12-03 11:15:52,600 - INFO - 
[107/189] Processing 491...
2025-12-03 11:15:52,600 - INFO - Processing participant: 491
2025-12-03 11:15:52,603 - ERROR -   ✗ Error processing participant 491: 'value'
2025-12-03 11:15:52,603 - INFO - 
[108/189] Processing 302...
2025-12-03 11:15:52,603 - INFO - Processing participant: 302
2025-12-03 11:15:52,618 - ERROR -   ✗ Error processing participant 302: 'value'
2025-12-03 11:15:52,618 - INFO - 
[109/189] Processing 307...
2025-12-03 11:15:52,618 - INFO - Processing participant: 307
2025-12-03 11:15:52,637 - ERROR -   ✗ Error processing participant 307: 'value'
2025-12-03 11:15:52,637 - INFO - 
[110/189] Processing 331...
2025-12-03 11:15:52,637 - INFO - Processing participant: 331
2025-12-03 11:15:52,658 - ERROR -   ✗ Error processing participant 331: 'value'
2025-12-03 11:15:52,658 - INFO - 
[111/189] Processing 335...
2025-12-03 11:15:52,658 - INFO - Processing participant: 335
2025-12-03 11:15:52,679 - ERROR -   ✗ Error processing participant 335: 'value'
2025-12-03 11:15:52,680 - INFO - 
[112/189] Processing 346...
2025-12-03 11:15:52,680 - INFO - Processing participant: 346
2025-12-03 11:15:52,737 - ERROR -   ✗ Error processing participant 346: 'value'
2025-12-03 11:15:52,737 - INFO - 
[113/189] Processing 367...
2025-12-03 11:15:52,737 - INFO - Processing participant: 367
2025-12-03 11:15:52,759 - ERROR -   ✗ Error processing participant 367: 'value'
2025-12-03 11:15:52,759 - INFO - 
[114/189] Processing 377...
2025-12-03 11:15:52,759 - INFO - Processing participant: 377
2025-12-03 11:15:52,790 - ERROR -   ✗ Error processing participant 377: 'value'
2025-12-03 11:15:52,790 - INFO - 
[115/189] Processing 381...
2025-12-03 11:15:52,790 - INFO - Processing participant: 381
2025-12-03 11:15:52,811 - ERROR -   ✗ Error processing participant 381: 'value'
2025-12-03 11:15:52,811 - INFO - 
[116/189] Processing 382...
2025-12-03 11:15:52,811 - INFO - Processing participant: 382
2025-12-03 11:15:52,832 - ERROR -   ✗ Error processing participant 382: 'value'
2025-12-03 11:15:52,832 - INFO - 
[117/189] Processing 388...
2025-12-03 11:15:52,832 - INFO - Processing participant: 388
2025-12-03 11:15:52,849 - ERROR -   ✗ Error processing participant 388: 'value'
2025-12-03 11:15:52,849 - INFO - 
[118/189] Processing 389...
2025-12-03 11:15:52,849 - INFO - Processing participant: 389
2025-12-03 11:15:52,864 - ERROR -   ✗ Error processing participant 389: 'value'
2025-12-03 11:15:52,865 - INFO - 
[119/189] Processing 390...
2025-12-03 11:15:52,865 - INFO - Processing participant: 390
2025-12-03 11:15:52,899 - ERROR -   ✗ Error processing participant 390: 'value'
2025-12-03 11:15:52,899 - INFO - 
[120/189] Processing 395...
2025-12-03 11:15:52,900 - INFO - Processing participant: 395
2025-12-03 11:15:52,936 - ERROR -   ✗ Error processing participant 395: 'value'
2025-12-03 11:15:52,937 - INFO - 
[121/189] Processing 403...
2025-12-03 11:15:52,937 - INFO - Processing participant: 403
2025-12-03 11:15:52,952 - ERROR -   ✗ Error processing participant 403: 'value'
2025-12-03 11:15:52,952 - INFO - 
[122/189] Processing 404...
2025-12-03 11:15:52,952 - INFO - Processing participant: 404
2025-12-03 11:15:52,967 - ERROR -   ✗ Error processing participant 404: 'value'
2025-12-03 11:15:52,968 - INFO - 
[123/189] Processing 406...
2025-12-03 11:15:52,968 - INFO - Processing participant: 406
2025-12-03 11:15:52,971 - ERROR -   ✗ Error processing participant 406: 'value'
2025-12-03 11:15:52,971 - INFO - 
[124/189] Processing 413...
2025-12-03 11:15:52,971 - INFO - Processing participant: 413
2025-12-03 11:15:52,986 - ERROR -   ✗ Error processing participant 413: 'value'
2025-12-03 11:15:52,986 - INFO - 
[125/189] Processing 417...
2025-12-03 11:15:52,986 - INFO - Processing participant: 417
2025-12-03 11:15:52,990 - ERROR -   ✗ Error processing participant 417: 'value'
2025-12-03 11:15:52,990 - INFO - 
[126/189] Processing 418...
2025-12-03 11:15:52,990 - INFO - Processing participant: 418
2025-12-03 11:15:53,003 - ERROR -   ✗ Error processing participant 418: 'value'
2025-12-03 11:15:53,003 - INFO - 
[127/189] Processing 420...
2025-12-03 11:15:53,003 - INFO - Processing participant: 420
2025-12-03 11:15:53,034 - ERROR -   ✗ Error processing participant 420: 'value'
2025-12-03 11:15:53,034 - INFO - 
[128/189] Processing 422...
2025-12-03 11:15:53,034 - INFO - Processing participant: 422
2025-12-03 11:15:53,065 - ERROR -   ✗ Error processing participant 422: 'value'
2025-12-03 11:15:53,065 - INFO - 
[129/189] Processing 436...
2025-12-03 11:15:53,065 - INFO - Processing participant: 436
2025-12-03 11:15:53,084 - ERROR -   ✗ Error processing participant 436: 'value'
2025-12-03 11:15:53,085 - INFO - 
[130/189] Processing 439...
2025-12-03 11:15:53,085 - INFO - Processing participant: 439
2025-12-03 11:15:53,118 - ERROR -   ✗ Error processing participant 439: 'value'
2025-12-03 11:15:53,118 - INFO - 
[131/189] Processing 440...
2025-12-03 11:15:53,118 - INFO - Processing participant: 440
2025-12-03 11:15:53,134 - ERROR -   ✗ Error processing participant 440: 'value'
2025-12-03 11:15:53,134 - INFO - 
[132/189] Processing 451...
2025-12-03 11:15:53,134 - INFO - Processing participant: 451
2025-12-03 11:15:53,154 - ERROR -   ✗ Error processing participant 451: 'value'
2025-12-03 11:15:53,154 - INFO - 
[133/189] Processing 458...
2025-12-03 11:15:53,154 - INFO - Processing participant: 458
2025-12-03 11:15:53,163 - ERROR -   ✗ Error processing participant 458: 'value'
2025-12-03 11:15:53,163 - INFO - 
[134/189] Processing 472...
2025-12-03 11:15:53,163 - INFO - Processing participant: 472
2025-12-03 11:15:53,191 - ERROR -   ✗ Error processing participant 472: 'value'
2025-12-03 11:15:53,191 - INFO - 
[135/189] Processing 476...
2025-12-03 11:15:53,191 - INFO - Processing participant: 476
2025-12-03 11:15:53,210 - ERROR -   ✗ Error processing participant 476: 'value'
2025-12-03 11:15:53,210 - INFO - 
[136/189] Processing 477...
2025-12-03 11:15:53,210 - INFO - Processing participant: 477
2025-12-03 11:15:53,226 - ERROR -   ✗ Error processing participant 477: 'value'
2025-12-03 11:15:53,226 - INFO - 
[137/189] Processing 482...
2025-12-03 11:15:53,226 - INFO - Processing participant: 482
2025-12-03 11:15:53,257 - ERROR -   ✗ Error processing participant 482: 'value'
2025-12-03 11:15:53,257 - INFO - 
[138/189] Processing 483...
2025-12-03 11:15:53,257 - INFO - Processing participant: 483
2025-12-03 11:15:53,271 - ERROR -   ✗ Error processing participant 483: 'value'
2025-12-03 11:15:53,271 - INFO - 
[139/189] Processing 484...
2025-12-03 11:15:53,271 - INFO - Processing participant: 484
2025-12-03 11:15:53,298 - ERROR -   ✗ Error processing participant 484: 'value'
2025-12-03 11:15:53,298 - INFO - 
[140/189] Processing 489...
2025-12-03 11:15:53,298 - INFO - Processing participant: 489
2025-12-03 11:15:53,301 - ERROR -   ✗ Error processing participant 489: 'value'
2025-12-03 11:15:53,301 - INFO - 
[141/189] Processing 490...
2025-12-03 11:15:53,301 - INFO - Processing participant: 490
2025-12-03 11:15:53,327 - ERROR -   ✗ Error processing participant 490: 'value'
2025-12-03 11:15:53,327 - INFO - 
[142/189] Processing 492...
2025-12-03 11:15:53,327 - INFO - Processing participant: 492
2025-12-03 11:15:53,349 - ERROR -   ✗ Error processing participant 492: 'value'
2025-12-03 11:15:53,350 - INFO - 
[143/189] Processing 300...
2025-12-03 11:15:53,350 - INFO - Processing participant: 300
2025-12-03 11:15:53,352 - ERROR -   ✗ Error processing participant 300: 'value'
2025-12-03 11:15:53,352 - INFO - 
[144/189] Processing 301...
2025-12-03 11:15:53,352 - INFO - Processing participant: 301
2025-12-03 11:15:53,392 - ERROR -   ✗ Error processing participant 301: 'value'
2025-12-03 11:15:53,392 - INFO - 
[145/189] Processing 306...
2025-12-03 11:15:53,392 - INFO - Processing participant: 306
2025-12-03 11:15:53,414 - ERROR -   ✗ Error processing participant 306: 'value'
2025-12-03 11:15:53,414 - INFO - 
[146/189] Processing 308...
2025-12-03 11:15:53,414 - INFO - Processing participant: 308
2025-12-03 11:15:53,440 - ERROR -   ✗ Error processing participant 308: 'value'
2025-12-03 11:15:53,440 - INFO - 
[147/189] Processing 309...
2025-12-03 11:15:53,440 - INFO - Processing participant: 309
2025-12-03 11:15:53,489 - ERROR -   ✗ Error processing participant 309: 'value'
2025-12-03 11:15:53,489 - INFO - 
[148/189] Processing 311...
2025-12-03 11:15:53,489 - INFO - Processing participant: 311
2025-12-03 11:15:53,512 - ERROR -   ✗ Error processing participant 311: 'value'
2025-12-03 11:15:53,512 - INFO - 
[149/189] Processing 314...
2025-12-03 11:15:53,512 - INFO - Processing participant: 314
2025-12-03 11:15:53,533 - ERROR -   ✗ Error processing participant 314: 'value'
2025-12-03 11:15:53,533 - INFO - 
[150/189] Processing 323...
2025-12-03 11:15:53,533 - INFO - Processing participant: 323
2025-12-03 11:15:53,553 - ERROR -   ✗ Error processing participant 323: 'value'
2025-12-03 11:15:53,553 - INFO - 
[151/189] Processing 329...
2025-12-03 11:15:53,553 - INFO - Processing participant: 329
2025-12-03 11:15:53,595 - ERROR -   ✗ Error processing participant 329: 'value'
2025-12-03 11:15:53,596 - INFO - 
[152/189] Processing 332...
2025-12-03 11:15:53,596 - INFO - Processing participant: 332
2025-12-03 11:15:53,616 - ERROR -   ✗ Error processing participant 332: 'value'
2025-12-03 11:15:53,616 - INFO - 
[153/189] Processing 334...
2025-12-03 11:15:53,616 - INFO - Processing participant: 334
2025-12-03 11:15:53,638 - ERROR -   ✗ Error processing participant 334: 'value'
2025-12-03 11:15:53,638 - INFO - 
[154/189] Processing 337...
2025-12-03 11:15:53,638 - INFO - Processing participant: 337
2025-12-03 11:15:53,754 - ERROR -   ✗ Error processing participant 337: 'value'
2025-12-03 11:15:53,754 - INFO - 
[155/189] Processing 349...
2025-12-03 11:15:53,754 - INFO - Processing participant: 349
2025-12-03 11:15:53,794 - ERROR -   ✗ Error processing participant 349: 'value'
2025-12-03 11:15:53,794 - INFO - 
[156/189] Processing 354...
2025-12-03 11:15:53,794 - INFO - Processing participant: 354
2025-12-03 11:15:53,811 - ERROR -   ✗ Error processing participant 354: 'value'
2025-12-03 11:15:53,811 - INFO - 
[157/189] Processing 359...
2025-12-03 11:15:53,812 - INFO - Processing participant: 359
2025-12-03 11:15:53,836 - ERROR -   ✗ Error processing participant 359: 'value'
2025-12-03 11:15:53,836 - INFO - 
[158/189] Processing 361...
2025-12-03 11:15:53,836 - INFO - Processing participant: 361
2025-12-03 11:15:53,859 - ERROR -   ✗ Error processing participant 361: 'value'
2025-12-03 11:15:53,859 - INFO - 
[159/189] Processing 365...
2025-12-03 11:15:53,859 - INFO - Processing participant: 365
2025-12-03 11:15:53,875 - ERROR -   ✗ Error processing participant 365: 'value'
2025-12-03 11:15:53,876 - INFO - 
[160/189] Processing 373...
2025-12-03 11:15:53,876 - INFO - Processing participant: 373
2025-12-03 11:15:53,893 - ERROR -   ✗ Error processing participant 373: 'value'
2025-12-03 11:15:53,894 - INFO - 
[161/189] Processing 378...
2025-12-03 11:15:53,894 - INFO - Processing participant: 378
2025-12-03 11:15:53,928 - ERROR -   ✗ Error processing participant 378: 'value'
2025-12-03 11:15:53,928 - INFO - 
[162/189] Processing 384...
2025-12-03 11:15:53,928 - INFO - Processing participant: 384
2025-12-03 11:15:53,946 - ERROR -   ✗ Error processing participant 384: 'value'
2025-12-03 11:15:53,946 - INFO - 
[163/189] Processing 387...
2025-12-03 11:15:53,946 - INFO - Processing participant: 387
2025-12-03 11:15:53,963 - ERROR -   ✗ Error processing participant 387: 'value'
2025-12-03 11:15:53,963 - INFO - 
[164/189] Processing 396...
2025-12-03 11:15:53,963 - INFO - Processing participant: 396
2025-12-03 11:15:53,979 - ERROR -   ✗ Error processing participant 396: 'value'
2025-12-03 11:15:53,979 - INFO - 
[165/189] Processing 399...
2025-12-03 11:15:53,979 - INFO - Processing participant: 399
2025-12-03 11:15:53,993 - ERROR -   ✗ Error processing participant 399: 'value'
2025-12-03 11:15:53,993 - INFO - 
[166/189] Processing 405...
2025-12-03 11:15:53,993 - INFO - Processing participant: 405
2025-12-03 11:15:54,022 - ERROR -   ✗ Error processing participant 405: 'value'
2025-12-03 11:15:54,022 - INFO - 
[167/189] Processing 407...
2025-12-03 11:15:54,022 - INFO - Processing participant: 407
2025-12-03 11:15:54,041 - ERROR -   ✗ Error processing participant 407: 'value'
2025-12-03 11:15:54,041 - INFO - 
[168/189] Processing 408...
2025-12-03 11:15:54,041 - INFO - Processing participant: 408
2025-12-03 11:15:54,051 - ERROR -   ✗ Error processing participant 408: 'value'
2025-12-03 11:15:54,051 - INFO - 
[169/189] Processing 410...
2025-12-03 11:15:54,051 - INFO - Processing participant: 410
2025-12-03 11:15:54,066 - ERROR -   ✗ Error processing participant 410: 'value'
2025-12-03 11:15:54,066 - INFO - 
[170/189] Processing 411...
2025-12-03 11:15:54,067 - INFO - Processing participant: 411
2025-12-03 11:15:54,082 - ERROR -   ✗ Error processing participant 411: 'value'
2025-12-03 11:15:54,082 - INFO - 
[171/189] Processing 421...
2025-12-03 11:15:54,082 - INFO - Processing participant: 421
2025-12-03 11:15:54,106 - ERROR -   ✗ Error processing participant 421: 'value'
2025-12-03 11:15:54,106 - INFO - 
[172/189] Processing 424...
2025-12-03 11:15:54,106 - INFO - Processing participant: 424
2025-12-03 11:15:54,125 - ERROR -   ✗ Error processing participant 424: 'value'
2025-12-03 11:15:54,125 - INFO - 
[173/189] Processing 431...
2025-12-03 11:15:54,125 - INFO - Processing participant: 431
2025-12-03 11:15:54,139 - ERROR -   ✗ Error processing participant 431: 'value'
2025-12-03 11:15:54,139 - INFO - 
[174/189] Processing 432...
2025-12-03 11:15:54,139 - INFO - Processing participant: 432
2025-12-03 11:15:54,162 - ERROR -   ✗ Error processing participant 432: 'value'
2025-12-03 11:15:54,162 - INFO - 
[175/189] Processing 435...
2025-12-03 11:15:54,162 - INFO - Processing participant: 435
2025-12-03 11:15:54,182 - ERROR -   ✗ Error processing participant 435: 'value'
2025-12-03 11:15:54,182 - INFO - 
[176/189] Processing 438...
2025-12-03 11:15:54,182 - INFO - Processing participant: 438
2025-12-03 11:15:54,204 - ERROR -   ✗ Error processing participant 438: 'value'
2025-12-03 11:15:54,204 - INFO - 
[177/189] Processing 442...
2025-12-03 11:15:54,204 - INFO - Processing participant: 442
2025-12-03 11:15:54,215 - ERROR -   ✗ Error processing participant 442: 'value'
2025-12-03 11:15:54,215 - INFO - 
[178/189] Processing 450...
2025-12-03 11:15:54,215 - INFO - Processing participant: 450
2025-12-03 11:15:54,247 - ERROR -   ✗ Error processing participant 450: 'value'
2025-12-03 11:15:54,247 - INFO - 
[179/189] Processing 452...
2025-12-03 11:15:54,247 - INFO - Processing participant: 452
2025-12-03 11:15:54,270 - ERROR -   ✗ Error processing participant 452: 'value'
2025-12-03 11:15:54,270 - INFO - 
[180/189] Processing 453...
2025-12-03 11:15:54,270 - INFO - Processing participant: 453
2025-12-03 11:15:54,306 - ERROR -   ✗ Error processing participant 453: 'value'
2025-12-03 11:15:54,306 - INFO - 
[181/189] Processing 461...
2025-12-03 11:15:54,306 - INFO - Processing participant: 461
2025-12-03 11:15:54,328 - ERROR -   ✗ Error processing participant 461: 'value'
2025-12-03 11:15:54,328 - INFO - 
[182/189] Processing 462...
2025-12-03 11:15:54,328 - INFO - Processing participant: 462
2025-12-03 11:15:54,331 - ERROR -   ✗ Error processing participant 462: 'value'
2025-12-03 11:15:54,331 - INFO - 
[183/189] Processing 465...
2025-12-03 11:15:54,331 - INFO - Processing participant: 465
2025-12-03 11:15:54,351 - ERROR -   ✗ Error processing participant 465: 'value'
2025-12-03 11:15:54,351 - INFO - 
[184/189] Processing 466...
2025-12-03 11:15:54,351 - INFO - Processing participant: 466
2025-12-03 11:15:54,373 - ERROR -   ✗ Error processing participant 466: 'value'
2025-12-03 11:15:54,373 - INFO - 
[185/189] Processing 467...
2025-12-03 11:15:54,373 - INFO - Processing participant: 467
2025-12-03 11:15:54,387 - ERROR -   ✗ Error processing participant 467: 'value'
2025-12-03 11:15:54,387 - INFO - 
[186/189] Processing 469...
2025-12-03 11:15:54,387 - INFO - Processing participant: 469
2025-12-03 11:15:54,411 - ERROR -   ✗ Error processing participant 469: 'value'
2025-12-03 11:15:54,412 - INFO - 
[187/189] Processing 470...
2025-12-03 11:15:54,412 - INFO - Processing participant: 470
2025-12-03 11:15:54,440 - ERROR -   ✗ Error processing participant 470: 'value'
2025-12-03 11:15:54,440 - INFO - 
[188/189] Processing 480...
2025-12-03 11:15:54,440 - INFO - Processing participant: 480
2025-12-03 11:15:54,452 - ERROR -   ✗ Error processing participant 480: 'value'
2025-12-03 11:15:54,452 - INFO - 
[189/189] Processing 481...
2025-12-03 11:15:54,452 - INFO - Processing participant: 481
2025-12-03 11:15:54,470 - ERROR -   ✗ Error processing participant 481: 'value'
2025-12-03 11:15:54,470 - WARNING - No results to save!

========================================================================
Job completed at: Wed Dec  3 11:15:55 EST 2025
Exit code: 0
========================================================================

✓ Output generated successfully:
-rw-rw-r--. 1 dipanjan dipanjan 39K Dec  3 09:39 genai_features.csv

Preview:
participant_id,cognitive_negativity,emotional_flatness,overall_risk,low_engagement,psychomotor_slowing,llm_reasoning,raw_response
303,0,8,7,0,0,,"### JSON RESULTS ###
{
""cognitive_negativity"": 0.5,
""emotional_flatness"": 8,

⚠️  Errors encountered: 5
First 10 errors:
[2025-12-03 13:35:55] Participant 343: JSON parse failed. Raw: "cognitive_negativity": 0,
"emotional_flatness": 0,
"low_engagement": 0,
"psychomotor_slowing": 0,
"...

Final GPU status:
Wed Dec  3 11:15:55 2025       
+-----------------------------------------------------------------------------------------+
| NVIDIA-SMI 570.124.06             Driver Version: 570.124.06     CUDA Version: 12.8     |
|-----------------------------------------+------------------------+----------------------+
| GPU  Name                 Persistence-M | Bus-Id          Disp.A | Volatile Uncorr. ECC |
| Fan  Temp   Perf          Pwr:Usage/Cap |           Memory-Usage | GPU-Util  Compute M. |
|                                         |                        |               MIG M. |
|=========================================+========================+======================|
|   0  NVIDIA H100 80GB HBM3          Off |   00000000:E3:00.0 Off |                    0 |
| N/A   51C    P0            124W /  700W |       1MiB /  81559MiB |     13%      Default |
|                                         |                        |             Disabled |
+-----------------------------------------+------------------------+----------------------+
                                                                                         
+-----------------------------------------------------------------------------------------+
| Processes:                                                                              |
|  GPU   GI   CI              PID   Type   Process name                        GPU Memory |
|        ID   ID                                                               Usage      |
|=========================================================================================|
|  No running processes found                                                             |
+-----------------------------------------------------------------------------------------+
